{
  "schema_version": 1,
  "plan_fingerprint": "sha256:7d53d859b13986da8efcf8122fd060d07c34b91f34908d1ac4f89a1187c5df95",
  "request_fingerprint": "sha256:4c04cb6a6352ef10b09403b8f5b7da03e71dbfd278606fc25edb5274c3399d59",
  "provider": {
    "endpoint": "http://127.0.0.1:11434/v1",
    "model": "example-review-model",
    "timeout_seconds": 45,
    "max_output_tokens": 256
  },
  "budgets": {
    "max_estimated_input_tokens": 5000
  }
}
